Issue Type,Summary,Description,Priority,Labels,Epic Name,Epic Link,Status,Components,Fix Version
Story,Additional ContextSource Providers,Social sentiment and fundamentals providers. ContextSource interface is framework-portable.,Low,requirement;framework-portable,,4.x.x Intelligence Expansion,To Do,data-providers,4.x.x
Story,Full Strategy Admin,Add/delete/rename strategies with custom scoring weights. Deferred until backtest validation.,Low,requirement;options-domain,,4.x.x Intelligence Expansion,To Do,config-ui;scoring-engine,4.x.x
Story,MCP Integration + Power BI + Multi-Agent Orchestration,"Claude Tools, Fabric/Power BI, Foundry multi-agent orchestration. MCP patterns are framework-portable.",Low,requirement;framework-portable,,4.x.x Intelligence Expansion,To Do,agents;ai-evaluation,4.x.x
Epic,Ongoing: Strategy Validation Reviews,External Claude assessments each build cycle. Findings triaged into Pipeline Fix / SKILL.md Tune / Backtest Variable.,High,validation;options-domain,Ongoing: Strategy Validation Reviews,,In Progress,scoring-engine;ai-evaluation,Ongoing
Story,Validation Review Process,Monthly minimum. 6-8 tickers per session spanning sectors and volatility profiles.,High,validation;options-domain,,Ongoing: Strategy Validation Reviews,In Progress,scoring-engine;ai-evaluation,Ongoing
Task,"First assessment complete (March 17, 2026)","22 evaluations, 6 tickers, 68% agreement rate. 8 findings triaged.",High,validation,,Ongoing: Strategy Validation Reviews,Done,scoring-engine;ai-evaluation,Ongoing
Task,Post-2.0.x assessment,Verify the 7 disagreements are resolved after pipeline fixes ship.,High,validation,,Ongoing: Strategy Validation Reviews,To Do,scoring-engine;ai-evaluation,Ongoing
